entry	local_link	source_path	selected_checkpoint	selection_metric	use	github_upload
viralm_r_v4_final_6l_gated_mil_kd	checkpoint/local_checkpoints/viralm_r_v4_final_6l_gated_mil_kd	/share/home/user/snliu/hybriDNA/viralm-r/checkpoint/realm_rank_v4_six_model/models/viralm_r_v4_final_6l_gated_mil_kd	best_mil_model.pt	seq_f1=0.894996, epoch=5	Final 6-layer ViraLM-R gated MIL KD model; epoch checkpoint files excluded from local index	no
viralm_r_v4_final_6l_meanpool_kd	checkpoint/local_checkpoints/viralm_r_v4_final_6l_meanpool_kd	/share/home/user/snliu/hybriDNA/viralm-r/checkpoint/realm_rank_v4_six_model/models/viralm_r_v4_final_6l_meanpool_kd	checkpoint-48740	eval_f1=0.8215085884988798, epoch=5	Final 6-layer ViraLM-R meanpool KD model; selected from trainer_state.json best_model_checkpoint	no
viralm_r_v4_final_12l_gated_mil	checkpoint/local_checkpoints/viralm_r_v4_final_12l_gated_mil	/share/home/user/snliu/hybriDNA/viralm-r/checkpoint/realm_rank_v4_six_model/models/viralm_r_v4_final_12l_gated_mil	best_mil_model.pt	seq_f1=0.915903, epoch=3	Final 12-layer ViraLM-R gated MIL model; epoch checkpoint files excluded from local index	no
viralm_r_staged_v4	checkpoint/local_checkpoints/viralm_r_staged_v4	/share/home/user/snliu/hybriDNA/viralm-r/eval/eval_euk_pro_o_vs_r/work_v4/staged_models/viralm-r	checkpoint-48740	eval_f1=0.8651515151515151, epoch=5	Staged ViraLM-R model for euk/pro O-vs-R evaluation; selected from trainer_state.json best_model_checkpoint	no
viralm_o_staged_v4	checkpoint/local_checkpoints/viralm_o_staged_v4	/share/home/user/snliu/hybriDNA/viralm-r/eval/eval_euk_pro_o_vs_r/work_v4/staged_models/viralm-o	.	not_applicable	Staged ViraLM-O model for euk/pro O-vs-R evaluation; source has no internal checkpoint-* candidates	no
